{
  "createDeck": {
    "deckId": "external-4242",
    "deckName": "Contract deck",
    "deckUrl": "https://arkhamdb.com/decklist/view/4242",
    "deckList": {
      "id": 4242,
      "name": "Contract deck",
      "investigator_code": "01001",
      "investigator_name": "Roland Banks",
      "slots": {
        "01016": 2,
        "c01018": 1
      },
      "sideSlots": [],
      "meta": "{\"alternate_front\":\"c90001\"}",
      "taboo_id": null,
      "url": "https://arkhamdb.com/decklist/view/4242",
      "externalField": "ignored by the decoder"
    }
  },
  "fetchDeck": {
    "url": "https://arkhamdb.com/decklist/view/4242"
  },
  "validateDeckList": {
    "id": 4242,
    "name": "Contract deck",
    "investigator_code": "01001",
    "investigator_name": "Roland Banks",
    "slots": {
      "01016": 2,
      "c01018": 1
    },
    "sideSlots": [],
    "meta": "{\"alternate_front\":\"c90001\"}",
    "taboo_id": null,
    "url": "https://arkhamdb.com/decklist/view/4242",
    "externalField": "ignored by the decoder"
  },
  "normalizedDeckList": {
    "slots": {
      "c01016": 2,
      "c01018": 1
    },
    "sideSlots": {},
    "investigator_code": "c01001",
    "investigator_name": "Roland Banks",
    "meta": "{\"alternate_front\":\"c90001\"}",
    "taboo_id": null,
    "url": "https://arkhamdb.com/decklist/view/4242",
    "id": "4242.0",
    "name": "Contract deck"
  },
  "deck": {
    "id": "00000000-0000-0000-0000-000000000017",
    "investigatorName": "Roland Banks",
    "lastUsedAt": null,
    "list": {
      "id": "4242.0",
      "investigator_code": "c01001",
      "investigator_name": "Roland Banks",
      "meta": "{\"alternate_front\":\"c90001\"}",
      "name": "Contract deck",
      "sideSlots": {},
      "slots": {
        "c01016": 2,
        "c01018": 1
      },
      "taboo_id": null,
      "url": "https://arkhamdb.com/decklist/view/4242"
    },
    "name": "Contract deck",
    "overlay": null,
    "playList": {
      "id": "4242.0",
      "investigator_code": "c01001",
      "investigator_name": "Roland Banks",
      "meta": "{\"alternate_front\":\"c90001\"}",
      "name": "Contract deck",
      "sideSlots": {},
      "slots": {
        "c01016": 2,
        "c01018": 1
      },
      "taboo_id": null,
      "url": "https://arkhamdb.com/decklist/view/4242"
    },
    "url": "https://arkhamdb.com/decklist/view/4242",
    "userId": 7
  },
  "validationErrors": [
    {
      "tag": "UnimplementedCard",
      "contents": "c99999"
    }
  ],
  "validationSuccess": [],
  "operationError": {
    "errorMsg": "Could not sync deck"
  }
}
